Key,id
i wanted to be able to,6g_s755
it was just kind of like,6g_s756
in front of thousands of people,6g_s757
good at what they do and,6g_s758
its what i want to do,6g_s759
i think its i think its,6g_s760
ive never seen anything like it,6g_s761
it was a lot of work,6g_s762
gon na have a really good,6g_s763
all i want to do is,6g_s764
we knew we were going to,6g_s765
i dont know if you guys,6g_s766
a lot of people that are,6g_s767
that i want to go to,6g_s768
im a high priest vatican assassin,6g_s769
the run i was on made,6g_s770
run i was on made sinatra,6g_s771
i was on made sinatra flynn,6g_s772
was on made sinatra flynn jagger,6g_s773
on made sinatra flynn jagger richards,6g_s774
made sinatra flynn jagger richards all,6g_s775
people to magic i expose them,6g_s776
to magic i expose them to,6g_s777
know man i was banging seven,6g_s778
i have a different heart i,6g_s779
have a different heart i have,6g_s780
when i was seven years old,6g_s781
to be able to be a,6g_s782
in the morning and i was,6g_s783
and im a big fan of,6g_s784
im a big fan of his,6g_s785
i think thats a good thing,6g_s786
between me and the president of,6g_s787
me and the president of the,6g_s788
i have to tell you the,6g_s789
have to tell you the truth,6g_s790
one of the things that we,6g_s791
that there are a lot of,6g_s792
and i want to carry on,6g_s793
i signed a new deal for,6g_s794
the beginning of the game and,6g_s795
beginning of the game and after,6g_s796
i just want to say that,6g_s797
i would have loved to have,6g_s798
stay in the english national team,6g_s799
in the english national team and,6g_s800
in the middle of nowhere and,6g_s801
lot of funny characters in this,6g_s802
what you want to do and,6g_s803
it makes me want to cry,6g_s804
the people that come up to,6g_s805
people that come up to me,6g_s806
two and a half years ago,6g_s807
when i was a kid my,6g_s808
its kind of like you know,6g_s809
and now were doing wildlife and,6g_s810
now were doing wildlife and conservation,6g_s811
end of the day we are,6g_s812
it was going to be like,6g_s813
so we had a lot of,6g_s814
and i think theres a lot,6g_s815
think theres a lot of people,6g_s816
i hope that in the future,6g_s817
i think the best way to,6g_s818
i want to say thank you,6g_s819
an aggressive sport right football like,6g_s820
aggressive sport right football like he,6g_s821
sport right football like he had,6g_s822
right football like he had a,6g_s823
football like he had a concussion,6g_s824
he has concussions pretty much i,6g_s825
has concussions pretty much i mean,6g_s826
concussions pretty much i mean we,6g_s827
pretty much i mean we dont,6g_s828
much i mean we dont talk,6g_s829
i mean we dont talk about,6g_s830
mean we dont talk about but,6g_s831
going to be part of the,6g_s832
were going to be talking about,6g_s833
think thats one of the reasons,6g_s834
its just going to be a,6g_s835
it a day at a time,6g_s836
when i read the script that,6g_s837
i dont know if you can,6g_s838
we do and what we do,6g_s839
i wake up in the morning,6g_s840
the always keep fighting campaign and,6g_s841
what they want to do and,6g_s842
keeps you on the edge of,6g_s843
you on the edge of your,6g_s844
and i feel like this is,6g_s845
and i felt like you know,6g_s846
he had texted me he had,6g_s847
had texted me he had texted,6g_s848
at this point in my life,6g_s849
a film in new york city,6g_s850
and i think thats really really,6g_s851
it was like it was like,6g_s852
it was electric really and it,6g_s853
was electric really and it was,6g_s854
electric really and it was like,6g_s855
us a great boost for the,6g_s856
a great boost for the start,6g_s857
great boost for the start and,6g_s858
boost for the start and then,6g_s859
for the start and then we,6g_s860
the start and then we carried,6g_s861
we created a lot of chances,6g_s862
and i think thats what people,6g_s863
i think its a really good,6g_s864
think its a really good movie,6g_s865
it got to the point where,6g_s866
got to the point where we,6g_s867
getting back into the real world,6g_s868
im estelle harris and im proud,6g_s869
estelle harris and im proud to,6g_s870
harris and im proud to be,6g_s871
and im proud to be a,6g_s872
im proud to be a braveheart,6g_s873
proud to be a braveheart woman,6g_s874
great to be a part of,6g_s875
i think thats what people love,6g_s876
think thats what people love about,6g_s877
its a really good movie and,6g_s878
a really good movie and i,6g_s879
really good movie and i think,6g_s880
good movie and i think its,6g_s881
movie and i think its a,6g_s882
and i think its a really,6g_s883
going to be a happy ending,6g_s884
they want it punch they want,6g_s885
he does gun smoke i said,6g_s886
does gun smoke i said no,6g_s887
my name is really richard boone,6g_s888
no he does have gun will,6g_s889
he does have gun will travel,6g_s890
does have gun will travel i,6g_s891
got to be on the ball,6g_s892
in the way that you describe,6g_s893
the way that you describe it,6g_s894
yeah we have a lot of,6g_s895
and i said to my son,6g_s896
this one was for the one,6g_s897
one was for the one that,6g_s898
interesting and effective because theyre very,6g_s899
and effective because theyre very grassroot,6g_s900
effective because theyre very grassroot oriented,6g_s901
because theyre very grassroot oriented and,6g_s902
theyre very grassroot oriented and i,6g_s903
very grassroot oriented and i think,6g_s904
grassroot oriented and i think that,6g_s905
oriented and i think that was,6g_s906
and i think that was the,6g_s907
i think that was the success,6g_s908
think that was the success of,6g_s909
that was the success of being,6g_s910
was the success of being on,6g_s911
the success of being on the,6g_s912
success of being on the obama,6g_s913
of being on the obama campaign,6g_s914
being on the obama campaign and,6g_s915
on the obama campaign and seeing,6g_s916
the obama campaign and seeing their,6g_s917
obama campaign and seeing their their,6g_s918
campaign and seeing their their ground,6g_s919
and seeing their their ground operation,6g_s920
seeing their their ground operation it,6g_s921
their their ground operation it really,6g_s922
their ground operation it really takes,6g_s923
ground operation it really takes a,6g_s924
operation it really takes a doortodoor,6g_s925
it really takes a doortodoor approach,6g_s926
really takes a doortodoor approach and,6g_s927
takes a doortodoor approach and i,6g_s928
a doortodoor approach and i think,6g_s929
doortodoor approach and i think thats,6g_s930
approach and i think thats something,6g_s931
which helped fundraise for the national,6g_s932
helped fundraise for the national election,6g_s933
fundraise for the national election and,6g_s934
for the national election and we,6g_s935
the national election and we had,6g_s936
national election and we had such,6g_s937
election and we had such success,6g_s938
and we had such success we,6g_s939
we had such success we raised,6g_s940
had such success we raised over,6g_s941
to have a good answer for,6g_s942
have a good answer for that,6g_s943
a good answer for that and,6g_s944
good answer for that and thats,6g_s945
answer for that and thats what,6g_s946
for that and thats what everybody,6g_s947
that and thats what everybody out,6g_s948
and thats what everybody out there,6g_s949
thats what everybody out there is,6g_s950
what everybody out there is asking,6g_s951
everybody out there is asking especially,6g_s952
out there is asking especially in,6g_s953
there is asking especially in the,6g_s954
is asking especially in the hispanic,6g_s955
asking especially in the hispanic community,6g_s956
um will help with uh with,6g_s957
will help with uh with those,6g_s958
help with uh with those issues,6g_s959
with uh with those issues that,6g_s960
uh with those issues that particularly,6g_s961
with those issues that particularly were,6g_s962
those issues that particularly were having,6g_s963
issues that particularly were having here,6g_s964
that particularly were having here in,6g_s965
particularly were having here in in,6g_s966
were having here in in texas,6g_s967
having here in in texas so,6g_s968
here in in texas so itll,6g_s969
in in texas so itll be,6g_s970
in texas so itll be interesting,6g_s971
texas so itll be interesting i,6g_s972
so itll be interesting i think,6g_s973
itll be interesting i think i,6g_s974
be interesting i think i think,6g_s975
interesting i think i think you,6g_s976
i think i think you know,6g_s977
to quality education or access to,6g_s978
whether its sexual equality marriage equality,6g_s979
its sexual equality marriage equality equal,6g_s980
sexual equality marriage equality equal pay,6g_s981
equality marriage equality equal pay reproduction,6g_s982
marriage equality equal pay reproduction rights,6g_s983
equality equal pay reproduction rights i,6g_s984
equal pay reproduction rights i mean,6g_s985
pay reproduction rights i mean and,6g_s986
reproduction rights i mean and im,6g_s987
rights i mean and im hoping,6g_s988
i mean and im hoping that,6g_s989
mean and im hoping that this,6g_s990
and im hoping that this younger,6g_s991
im hoping that this younger generation,6g_s992
hoping that this younger generation which,6g_s993
that this younger generation which tends,6g_s994
this younger generation which tends to,6g_s995
younger generation which tends to be,6g_s996
generation which tends to be largely,6g_s997
hispanics you know do have some,6g_s998
you know do have some conservative,6g_s999
know do have some conservative values,6g_s1000
do have some conservative values whether,6g_s1001
have some conservative values whether its,6g_s1002
some conservative values whether its through,6g_s1003
conservative values whether its through religion,6g_s1004
values whether its through religion or,6g_s1005
whether its through religion or upbringing,6g_s1006
community we cant deny the fact,6g_s1007
we cant deny the fact that,6g_s1008
most of the millennials are hispanic,6g_s1009
of the millennials are hispanic the,6g_s1010
the millennials are hispanic the people,6g_s1011
millennials are hispanic the people that,6g_s1012
are hispanic the people that are,6g_s1013
hispanic the people that are coming,6g_s1014
the people that are coming up,6g_s1015
people that are coming up which,6g_s1016
that are coming up which means,6g_s1017
are coming up which means theyre,6g_s1018
coming up which means theyre young,6g_s1019
up which means theyre young which,6g_s1020
which means theyre young which means,6g_s1021
means theyre young which means theyve,6g_s1022
theyre young which means theyve grown,6g_s1023
young which means theyve grown up,6g_s1024
which means theyve grown up with,6g_s1025
is voter education i mean just,6g_s1026
voter education i mean just making,6g_s1027
education i mean just making them,6g_s1028
i mean just making them aware,6g_s1029
mean just making them aware of,6g_s1030
just making them aware of how,6g_s1031
making them aware of how policies,6g_s1032
them aware of how policies disproportionately,6g_s1033
aware of how policies disproportionately affect,6g_s1034
of how policies disproportionately affect them,6g_s1035
because i believe that if you,6g_s1036
i believe that if you get,6g_s1037
believe that if you get an,6g_s1038
that if you get an education,6g_s1039
if you get an education you,6g_s1040
you get an education you can,6g_s1041
i happen to love this country,6g_s1042
happen to love this country and,6g_s1043
i raised my hand and told,6g_s1044
raised my hand and told mrs,6g_s1045
my hand and told mrs johnson,6g_s1046
hand and told mrs johnson what,6g_s1047
the young boys of this country,6g_s1048
to work with him was not,6g_s1049
work with him was not always,6g_s1050
with him was not always the,6g_s1051
him was not always the most,6g_s1052
was not always the most exciting,6g_s1053
not always the most exciting thing,6g_s1054
always the most exciting thing in,6g_s1055
the most exciting thing in the,6g_s1056
most exciting thing in the world,6g_s1057
exciting thing in the world in,6g_s1058
thing in the world in the,6g_s1059
in the world in the manner,6g_s1060
the world in the manner in,6g_s1061
being as physically huge as he,6g_s1062
as physically huge as he was,6g_s1063
so forth and so on and,6g_s1064
should still have a kind of,6g_s1065
still have a kind of show,6g_s1066
have a kind of show like,6g_s1067
it i didnt know i was,6g_s1068
way to do it is to,6g_s1069
youre kind of a little bit,6g_s1070
probably torturing his ass right now,6g_s1071
torturing his ass right now trying,6g_s1072
his ass right now trying to,6g_s1073
ass right now trying to find,6g_s1074
right now trying to find out,6g_s1075
now trying to find out what,6g_s1076
trying to find out what the,6g_s1077
to find out what the fuck,6g_s1078
find out what the fuck he,6g_s1079
out what the fuck he know,6g_s1080
what the fuck he know or,6g_s1081
the fuck he know or didnt,6g_s1082
fuck he know or didnt know,6g_s1083
he know or didnt know and,6g_s1084
know or didnt know and the,6g_s1085
or didnt know and the rest,6g_s1086
didnt know and the rest of,6g_s1087
know and the rest of the,6g_s1088
and the rest of the prayers,6g_s1089
the rest of the prayers going,6g_s1090
rest of the prayers going out,6g_s1091
of the prayers going out to,6g_s1092
the prayers going out to the,6g_s1093
prayers going out to the families,6g_s1094
going out to the families of,6g_s1095
out to the families of those,6g_s1096
to the families of those who,6g_s1097
the families of those who have,6g_s1098
families of those who have family,6g_s1099
of those who have family members,6g_s1100
should have been stopped we need,6g_s1101
have been stopped we need to,6g_s1102
been stopped we need to have,6g_s1103
stopped we need to have the,6g_s1104
we need to have the international,6g_s1105
need to have the international criminal,6g_s1106
to have the international criminal court,6g_s1107
have the international criminal court we,6g_s1108
the international criminal court we need,6g_s1109
international criminal court we need to,6g_s1110
criminal court we need to have,6g_s1111
court we need to have that,6g_s1112
we need to have that with,6g_s1113
need to have that with teeth,6g_s1114
to have that with teeth all,6g_s1115
have that with teeth all dictators,6g_s1116
that with teeth all dictators should,6g_s1117
with teeth all dictators should immediately,6g_s1118
teeth all dictators should immediately go,6g_s1119
all dictators should immediately go and,6g_s1120
dictators should immediately go and have,6g_s1121
should immediately go and have life,6g_s1122
immediately go and have life imprisonment,6g_s1123
go and have life imprisonment you,6g_s1124
and have life imprisonment you dont,6g_s1125
have life imprisonment you dont even,6g_s1126
life imprisonment you dont even need,6g_s1127
imprisonment you dont even need to,6g_s1128
you dont even need to try,6g_s1129
dont even need to try them,6g_s1130
even need to try them if,6g_s1131
need to try them if you,6g_s1132
to try them if you think,6g_s1133
try them if you think about,6g_s1134
them if you think about it,6g_s1135
if you think about it because,6g_s1136
you think about it because you,6g_s1137
think about it because you dont,6g_s1138
about it because you dont need,6g_s1139
it because you dont need to,6g_s1140
because you dont need to prove,6g_s1141
dictators theyre already a dictator so,6g_s1142
have you heard about the mayor,6g_s1143
a lot of the time and,6g_s1144
back and back and back and,6g_s1145
want a classic rock story yeah,6g_s1146
a classic rock story yeah i,6g_s1147
classic rock story yeah i when,6g_s1148
rock story yeah i when i,6g_s1149
story yeah i when i was,6g_s1150
yeah i when i was 14,6g_s1151
i when i was 14 years,6g_s1152
when i was 14 years old,6g_s1153
i was 14 years old i,6g_s1154
was 14 years old i went,6g_s1155
14 years old i went for,6g_s1156
didnt think they were going to,6g_s1157
and going back and forth and,6g_s1158
quite a few years i think,6g_s1159
i dont think you have to,6g_s1160
you can never go home again,6g_s1161
was going to be on the,6g_s1162
somethings afoot and hes happy when,6g_s1163
afoot and hes happy when hes,6g_s1164
and hes happy when hes talking,6g_s1165
hes not as big a legend,6g_s1166
not as big a legend as,6g_s1167
as big a legend as he,6g_s1168
big a legend as he thinks,6g_s1169
a legend as he thinks he,6g_s1170
legend as he thinks he is,6g_s1171
as he thinks he is and,6g_s1172
he thinks he is and that,6g_s1173
thinks he is and that the,6g_s1174
he is and that the town,6g_s1175
is and that the town wasnt,6g_s1176
and that the town wasnt all,6g_s1177
that the town wasnt all it,6g_s1178
the town wasnt all it was,6g_s1179
town wasnt all it was cracked,6g_s1180
wasnt all it was cracked up,6g_s1181
all it was cracked up to,6g_s1182
it was cracked up to be,6g_s1183
was cracked up to be anyway,6g_s1184
cracked up to be anyway so,6g_s1185
up to be anyway so i,6g_s1186
to be anyway so i think,6g_s1187
be anyway so i think in,6g_s1188
anyway so i think in this,6g_s1189
so i think in this particular,6g_s1190
i think in this particular case,6g_s1191
think in this particular case it,6g_s1192
in this particular case it was,6g_s1193
this particular case it was something,6g_s1194
particular case it was something like,6g_s1195
case it was something like this,6g_s1196
it was something like this is,6g_s1197
was something like this is the,6g_s1198
accept that more readily than the,6g_s1199
that more readily than the idea,6g_s1200
more readily than the idea that,6g_s1201
readily than the idea that hes,6g_s1202
than the idea that hes getting,6g_s1203
the idea that hes getting older,6g_s1204
idea that hes getting older like,6g_s1205
that hes getting older like this,6g_s1206
but you know youve got to,6g_s1207
its the same way that some,6g_s1208
fight against arnold so he was,6g_s1209
against arnold so he was like,6g_s1210
arnold so he was like i,6g_s1211
so he was like i grew,6g_s1212
he was like i grew up,6g_s1213
was like i grew up watching,6g_s1214
like i grew up watching his,6g_s1215
so honored to be here and,6g_s1216
honored to be here and to,6g_s1217
to be here and to be,6g_s1218
be here and to be part,6g_s1219
here and to be part of,6g_s1220
and to be part of this,6g_s1221
to be part of this movie,6g_s1222
be part of this movie and,6g_s1223
part of this movie and to,6g_s1224
of this movie and to fight,6g_s1225
in such a way that it,6g_s1226
which is why we gathered in,6g_s1227
is why we gathered in washington,6g_s1228
so i turned back to that,6g_s1229
i turned back to that guy,6g_s1230
turned back to that guy again,6g_s1231
back to that guy again after,6g_s1232
to that guy again after i,6g_s1233
that guy again after i answered,6g_s1234
guy again after i answered the,6g_s1235
again after i answered the next,6g_s1236
after i answered the next question,6g_s1237
i answered the next question i,6g_s1238
answered the next question i said,6g_s1239
the next question i said i,6g_s1240
next question i said i wasnt,6g_s1241
question i said i wasnt satisfied,6g_s1242
i said i wasnt satisfied with,6g_s1243
said i wasnt satisfied with my,6g_s1244
i wasnt satisfied with my answer,6g_s1245
wasnt satisfied with my answer what,6g_s1246
satisfied with my answer what i,6g_s1247
with my answer what i would,6g_s1248
my answer what i would want,6g_s1249
answer what i would want to,6g_s1250
what i would want to say,6g_s1251
i would want to say is,6g_s1252
would want to say is that,6g_s1253
and they were not chuckling too,6g_s1254
they were not chuckling too loudly,6g_s1255
were not chuckling too loudly at,6g_s1256
not chuckling too loudly at this,6g_s1257
chuckling too loudly at this particular,6g_s1258
too loudly at this particular show,6g_s1259
loudly at this particular show very,6g_s1260
at this particular show very worried,6g_s1261
this particular show very worried about,6g_s1262
start rehearsing and all the jokes,6g_s1263
rehearsing and all the jokes are,6g_s1264
and all the jokes are about,6g_s1265
all the jokes are about death,6g_s1266
the jokes are about death and,6g_s1267
and there were two shows left,6g_s1268
there were two shows left and,6g_s1269
were two shows left and jay,6g_s1270
two shows left and jay had,6g_s1271
shows left and jay had a,6g_s1272
left and jay had a vacation,6g_s1273
i was doing a lot of,6g_s1274
i walked out of the room,6g_s1275
you know ive paid the price,6g_s1276
know ive paid the price already,6g_s1277
ive paid the price already my,6g_s1278
paid the price already my show,6g_s1279
the price already my show got,6g_s1280
price already my show got canceled,6g_s1281
i found out years later when,6g_s1282
found out years later when i,6g_s1283
out years later when i left,6g_s1284
years later when i left mary,6g_s1285
later when i left mary turned,6g_s1286
when i left mary turned to,6g_s1287
i left mary turned to them,6g_s1288
left mary turned to them and,6g_s1289
mary turned to them and said,6g_s1290
and i got bombarded and swarmed,6g_s1291
i got bombarded and swarmed it,6g_s1292
got bombarded and swarmed it was,6g_s1293
bombarded and swarmed it was cool,6g_s1294
and swarmed it was cool but,6g_s1295
swarmed it was cool but it,6g_s1296
it was cool but it was,6g_s1297
was cool but it was just,6g_s1298
cool but it was just weird,6g_s1299
get out of the way punk,6g_s1300
to be honest i dont know,6g_s1301
you know you couldnt just sightread,6g_s1302
know you couldnt just sightread them,6g_s1303
you couldnt just sightread them and,6g_s1304
couldnt just sightread them and just,6g_s1305
just sightread them and just go,6g_s1306
sightread them and just go oh,6g_s1307
them and just go oh yeah,6g_s1308
and just go oh yeah its,6g_s1309
we had quite difficult scenes to,6g_s1310
had quite difficult scenes to do,6g_s1311
ken and myself and they got,6g_s1312
and myself and they got quite,6g_s1313
myself and they got quite intense,6g_s1314
and they got quite intense and,6g_s1315
they got quite intense and for,6g_s1316
got quite intense and for the,6g_s1317
quite intense and for the first,6g_s1318
intense and for the first time,6g_s1319
and for the first time ever,6g_s1320
i wanted to escape a character,6g_s1321
easy scene and they had to,6g_s1322
scene and they had to be,6g_s1323
and they had to be quite,6g_s1324
they had to be quite well,6g_s1325
had to be quite well worked,6g_s1326
to be quite well worked but,6g_s1327
with nick the director whos absolutely,6g_s1328
nick the director whos absolutely brilliant,6g_s1329
the director whos absolutely brilliant and,6g_s1330
director whos absolutely brilliant and with,6g_s1331
whos absolutely brilliant and with ken,6g_s1332
absolutely brilliant and with ken it,6g_s1333
brilliant and with ken it just,6g_s1334
and with ken it just you,6g_s1335
with ken it just you know,6g_s1336
ken it just you know wed,6g_s1337
it just you know wed blocked,6g_s1338
just you know wed blocked the,6g_s1339
you know wed blocked the scene,6g_s1340
know wed blocked the scene and,6g_s1341
wed blocked the scene and then,6g_s1342
blocked the scene and then because,6g_s1343
the scene and then because hes,6g_s1344
scene and then because hes just,6g_s1345
and then because hes just so,6g_s1346
then because hes just so brilliant,6g_s1347
because hes just so brilliant it,6g_s1348
i would like to say that,6g_s1349
ta ta ta ta ta ta,6g_s1350
da da da da da da,6g_s1351
we have to make sure that,6g_s1352
the most important thing is that,6g_s1353
i am very happy to be,6g_s1354
so its going to be a,6g_s1355
we need to make sure that,6g_s1356
its been a long time since,6g_s1357
its going to be a tough,6g_s1358
we want to make sure that,6g_s1359
what are we going to do,6g_s1360
kaka kaka kaka kaka kaka kaka,6g_s1361
the most important thing is to,6g_s1362
many many many many many many,6g_s1363
you know what im saying so,6g_s1364
at the end of the game,6g_s1365
to do with the fact that,6g_s1366
the point of view of the,6g_s1367
from the bottom of my heart,6g_s1368
i think there are a lot,6g_s1369
think there are a lot of,6g_s1370
there is no such thing as,6g_s1371
we have to be able to,6g_s1372
first of all i would like,6g_s1373
its going to be a very,6g_s1374
of all i would like to,6g_s1375
but there are a lot of,6g_s1376
i have to say that i,6g_s1377
have to make sure that we,6g_s1378
the end of the day the,6g_s1379
i would have liked to have,6g_s1380
and im really looking forward to,6g_s1381
i would like to thank the,6g_s1382
i dont want to be a,6g_s1383
to get to the bottom of,6g_s1384
that we will be able to,6g_s1385
there were a lot of people,6g_s1386
that there is a lot of,6g_s1387
over the last couple of years,6g_s1388
of the united states of america,6g_s1389
what we need to do is,6g_s1390
when i was a child i,6g_s1391
that has nothing to do with,6g_s1392
a lot of people in the,6g_s1393
and at the same time we,6g_s1394
i spend a lot of time,6g_s1395
at the same time i was,6g_s1396
and i have to say that,6g_s1397
dont know i dont know i,6g_s1398
are a lot of things that,6g_s1399
its going to be a really,6g_s1400
at the same time we have,6g_s1401
of the president of the republic,6g_s1402
wake up in the morning and,6g_s1403
i would like to thank all,6g_s1404
i think it will be a,6g_s1405
at the beginning of the year,6g_s1406
very happy to be able to,6g_s1407
to make sure that we have,6g_s1408
so i think its going to,6g_s1409
in order to be able to,6g_s1410
we will not be able to,6g_s1411
and if you look at the,6g_s1412
