Key,id
thats one of the reasons why,6g_s1413
i have done a lot of,6g_s1414
there are still a lot of,6g_s1415
i would like to thank you,6g_s1416
a lot of people out there,6g_s1417
i would like to express my,6g_s1418
thats just the way it is,6g_s1419
we have a lot of fun,6g_s1420
i knew i was going to,6g_s1421
but the most important thing is,6g_s1422
you know i want to be,6g_s1423
have a lot of work to,6g_s1424
you know what im saying but,6g_s1425
put a lot of pressure on,6g_s1426
but i have to say that,6g_s1427
but at the same time the,6g_s1428
i dont think its going to,6g_s1429
its not going to be easy,6g_s1430
i wish you all the best,6g_s1431
know what i mean so i,6g_s1432
for us to be able to,6g_s1433
we knew it was going to,6g_s1434
at the same time it is,6g_s1435
you know what im saying like,6g_s1436
know its going to be a,6g_s1437
never know whats going to happen,6g_s1438
im going to be able to,6g_s1439
a very good friend of mine,6g_s1440
was a little bit of a,6g_s1441
i would like to tell you,6g_s1442
and were going to have to,6g_s1443
but on the other hand i,6g_s1444
a lot of people who have,6g_s1445
came up to me and said,6g_s1446
to be a little bit more,6g_s1447
is one of the most important,6g_s1448
there has been a lot of,6g_s1449
i dont have a problem with,6g_s1450
i think if you look at,6g_s1451
have to do a lot of,6g_s1452
and there were a lot of,6g_s1453
its going to be a good,6g_s1454
that is to say that we,6g_s1455
there have been a lot of,6g_s1456
you know what i mean it,6g_s1457
you know what i mean im,6g_s1458
need to make sure that we,6g_s1459
know there are a lot of,6g_s1460
by the end of the year,6g_s1461
think the most important thing is,6g_s1462
to spend a lot of time,6g_s1463
a lot of things that i,6g_s1464
because i have a lot of,6g_s1465
we are going to talk about,6g_s1466
got a lot of work to,6g_s1467
going to be a tough game,6g_s1468
but if you look at the,6g_s1469
going to have a lot of,6g_s1470
have to find a way to,6g_s1471
know i dont know i dont,6g_s1472
want to make sure that we,6g_s1473
i dont have to worry about,6g_s1474
to be able to have a,6g_s1475
i think its very important to,6g_s1476
at the end of the week,6g_s1477
from the beginning to the end,6g_s1478
for the first time in the,6g_s1479
we have to take care of,6g_s1480
that you know what i mean,6g_s1481
to go out there and do,6g_s1482
so i have a lot of,6g_s1483
dont know what im going to,6g_s1484
do it in a way that,6g_s1485
to get to know each other,6g_s1486
am very happy to be here,6g_s1487
what we want to do is,6g_s1488
i think you have to be,6g_s1489
and so on and so on,6g_s1490
to do a lot of things,6g_s1491
what we have to do is,6g_s1492
this is the first time that,6g_s1493
at the beginning of the season,6g_s1494
to the best of my ability,6g_s1495
thank you very much for your,6g_s1496
i think its very important that,6g_s1497
i was born and raised in,6g_s1498
to get the best out of,6g_s1499
i think thats the most important,6g_s1500
but its going to be a,6g_s1501
i dont want to say that,6g_s1502
weve got to make sure that,6g_s1503
there was a lot of pressure,6g_s1504
we need to be able to,6g_s1505
the end of the day if,6g_s1506
you know to be able to,6g_s1507
i am a member of the,6g_s1508
and thats what i want to,6g_s1509
i dont think i would have,6g_s1510
it in such a way that,6g_s1511
have a long way to go,6g_s1512
for the first time in a,6g_s1513
and i think we have to,6g_s1514
dont want to talk about it,6g_s1515
i have to tell you that,6g_s1516
i dont know what im going,6g_s1517
but at the same time they,6g_s1518
to do everything we can to,6g_s1519
well have to wait and see,6g_s1520
to go out there and play,6g_s1521
at the end of the month,6g_s1522
got to do a better job,6g_s1523
you have to make sure that,6g_s1524
it has to do with the,6g_s1525
we got to know each other,6g_s1526
i think it is very important,6g_s1527
are going to be able to,6g_s1528
over a long period of time,6g_s1529
and at the same time the,6g_s1530
the end of the day were,6g_s1531
youre going to be able to,6g_s1532
spend a lot of time with,6g_s1533
i said i dont want to,6g_s1534
i was you know i was,6g_s1535
youre not going to be able,6g_s1536
i think thats going to be,6g_s1537
has nothing to do with it,6g_s1538
a lot of work to be,6g_s1539
i would like to point out,6g_s1540
i dont know if its a,6g_s1541
it means a lot to me,6g_s1542
the second half of the season,6g_s1543
had a lot to do with,6g_s1544
youve got to be able to,6g_s1545
you can do whatever you want,6g_s1546
put a lot of effort into,6g_s1547
of the best players in the,6g_s1548
and i think it was a,6g_s1549
you have to look at the,6g_s1550
end of the day you know,6g_s1551
i would like to say to,6g_s1552
i have a lot of fun,6g_s1553
you know what i mean we,6g_s1554
what i want to do i,6g_s1555
in the united states of america,6g_s1556
got to go out there and,6g_s1557
i dont want to do that,6g_s1558
so we have a lot of,6g_s1559
its going to be a big,6g_s1560
to make sure that we are,6g_s1561
we want to be able to,6g_s1562
want to go out there and,6g_s1563
this is one of the most,6g_s1564
i think it was a very,6g_s1565
and i think we need to,6g_s1566
for the first time i was,6g_s1567
and thats what its all about,6g_s1568
lot of work to be done,6g_s1569
was a lot of fun i,6g_s1570
you have to know how to,6g_s1571
there are a lot of good,6g_s1572
so i think we need to,6g_s1573
a big part of my life,6g_s1574
at the same time there is,6g_s1575
going to go out there and,6g_s1576
a year and a half and,6g_s1577
i would love to work with,6g_s1578
first of all i want to,6g_s1579
i want to tell you that,6g_s1580
think one of the things that,6g_s1581